Sanskrit_Romanized,Sanskrit_Devanagri,Extended_English_Translation
"parānandānubhūtiḥ syān mokṣe tu viṣayād ṛte | 
viṣayeṣu viraktāḥ syur nityānandānubhūtitaḥ | 
gacchanty apunar āvṛttiṁ mokṣam eva mumukṣavaḥ ||41||","परानन्दानुभूतिः स्यान् मोक्षे तु विषयाद् ऋते । 
विषयेषु विरक्ताः स्युर् नित्यानन्दानुभूतितः । 
गच्छन्त्य् अपुनर् आवृत्तिं मोक्षम् एव मुमुक्षवः ||४१||","41. In the state of final deliverance, there occurs, (even) in the absence of the objects of the senses, the experience of the highest bliss. Through (this) experience of eternal bliss, all those, who are desirous of (the salvation of) final release, become freed from attachment to the objects of the senses, and reach that condition of final deliverance from which there is no returning (to this world of samsara)."
